{
  "$schema": "../../schemas/command.schema.json",
  "name": "up",
  "options": [
    {
      "flags": "--merge-compose",
      "description": "Start the project's Compose infrastructure as well."
    },
    {
      "flags": "--merge-file <compose-file>",
      "description": "Merge this project Compose file last, overriding docker-dev."
    }
  ],
  "summary": "Start the development shell.",
  "help": "Starts the persistent development container and opens a shell. custom-compose.yml is applied after docker-dev's base, plugin and port configuration. Use --merge-compose to include the project's Compose infrastructure; --merge-file selects one explicitly and applies it last, overriding all other Compose files.",
  "steps": [
    {
      "call": {
        "function": "requireSetup"
      }
    },
    {
      "call": {
        "function": "start"
      }
    },
    {
      "call": {
        "function": "execInDev",
        "args": ["dev", "bash"]
      }
    }
  ]
}
