{
  "$schema": "../../../../schemas/command.schema.json",
  "name": "semgrep:scan",
  "args": "[path]",
  "options": [
    {
      "flags": "--no-fail",
      "description": "Write report without failing when findings are detected."
    }
  ],
  "summary": "Scan a project path for code vulnerabilities with Semgrep.",
  "help": "Scans the selected project path inside the development container. The default path is the project root. Writes a JSON report to .docker-dev/reports/semgrep.json and exits with a non-zero status when Semgrep finds issues at the configured severity.",
  "output": { "file": "reports/semgrep.json" },
  "steps": [
    {
      "call": {
        "function": "scanSemgrepPath",
        "args": ["$@"]
      }
    }
  ]
}
