{
  "$schema": "../../schemas/command.schema.json",
  "name": "rebuild",
  "summary": "Rebuild and recreate the development container.",
  "help": "Rebuild and recreate the development container. Use --force to replace locally modified managed assets with the version bundled in docker-dev.",
  "options": [
    {
      "flags": "--force",
      "description": "Replace locally modified managed assets during refresh."
    }
  ],
  "steps": [
    {
      "call": {
        "function": "requireSetup"
      }
    },
    {
      "call": {
        "function": "refreshAssets"
      }
    },
    {
      "call": {
        "function": "compose",
        "args": ["up", "--detach", "--build", "--force-recreate"]
      }
    },
    {
      "call": {
        "function": "installAsdfTools"
      }
    },
    {
      "call": {
        "function": "runPluginHook",
        "args": ["post-asdf"]
      }
    }
  ]
}
