{
  "$schema": "../../../../../../schemas/command.schema.json",
  "name": "yarn",
  "args": "<project-relative-path> [yarn-arguments...]",
  "summary": "Run the protected yarn wrapper.",
  "help": "Run yarn inside the protected development container.",
  "steps": [
    {
      "call": {
        "function": "runYarnWrapper",
        "args": ["$@"]
      }
    }
  ]
}
